<?xml version="1.0" encoding="UTF-8"?>
<cine   xmlns:xsi="http://www.w3.org/2001/XMLSchema-instance"
        xsi:noNamespaceSchemaLocation="cine.xsd">
    <pelicula categoria="accion">
        <titulo>Mad Max</titulo>
        <director>George Miller</director>
        <estreno>15 mayo 2015</estreno>
        <reparto>
            <actor>Tom Hardy</actor>
            <actor>Charlize Theron</actor>
            <actor>Nicholas Hoult</actor>
        </reparto>
    </pelicula>
    <pelicula categoria="animacion">
        <titulo idioma="ingles">Inside Out</titulo>
        <director>Pete Docter</director>
        <estreno>17 junio 2015</estreno>
        <reparto>
            <actor>Amy Poehler</actor>
            <actor>Phyllis Smith</actor>
            <actor>Bill Hader</actor>
        </reparto>
    </pelicula>
</cine>